Usuário,Reply,Conteúdo,Reações,Editado
Sheila Moura,,"O remédio não teve eficácia comprovada. Vocês realmente tem dificuldade em estudar, nem um texto curto conseguem ler.",9,FALSE
Douglas Mello Almeidinha,Sheila Moura,"pois é. Eles acham que porque um estudo foi invalidado, os outros também foram invalidados por tabela!",1,FALSE
Diogo Fazolin,Sheila Moura,"pergunta da eficácia dele para o Dr. David Uip... Ah, não esse não fala para o povo o remédio que ele tomou... Bom, pergunta para o cardiologista Dr. Roberto Kalil...",2,TRUE
Sheila Moura,Douglas Mello Almeidinha,Difícil dizer algo pra quem expõe orgulhoso a ignorância.,1,FALSE
Sheila Moura,,"Me baseio no que diz a ciência. Quando todos os testes provarem a eficácia do medicamento no combate a essa doença, considerarei que sim ele pode ser usado. Que será segura a sua prescrição pra ajudar o povo. Enquanto isso não acontece, como saberei, n…Ver mais",2,FALSE
Rita Delazari,Sheila Moura,"A imagem pode conter: ‎uma ou mais pessoas, ‎texto que diz ""‎11:13 مه 79% Publicação tonibritonutri dP Jovem Pan OMS se desculpa por controvérsias em pesquisas sobre hidroxicloroquina Jovem Pan 19 horas atrás‎""‎‎",0,FALSE
Rita Delazari,,"A imagem pode conter: texto que diz ""Covid19 9...a luta continua! tonibritonutri rfi Autores do estudo da revista The Lancet que criticava hi- droxicloroquina pedem des- culpas Publicado 05/06/2020 Geietles Beиiies contentfre THE LANCET Searchfor Audie tonibritonutri Queeee faseeeeeeee #thelance Fico triste ao. mais""",0,FALSE
Rita Delazari,,Nenhuma descrição de foto disponível.,0,FALSE
Sheila Moura,,"Minha senhora amaria que me dissessem que os cientistas descobriram que Doril tem efeito no tratamento dessa doença. Doril, Anador, Cloroquina, qualquer coisa. Infelizmente nao foi isso que aconteceu. As desculpas da OMS são em função da seriedade com …Ver mais",1,FALSE
Sheila Moura,,Essa atenção é que as pessoas precisam ter quando leem ou ouvem as notícias. Tenho certeza que todos vamos amar que esse remedio tenha eficacia comprovada por cientistas. Ninguem quer ver o povo morrendo aos milhares. Ninguem quer continuar nessa angu…Ver mais,1,FALSE
Corouna Esmeralda,Sheila Moura,Concordo plenamente.,1,FALSE
Sheila Moura,Corouna Esmeralda,Se cuide aí!,1,FALSE
Rafael Ol,,Bolsonaro só tem razão que não será nunca mais presidente aqui no Brasil...,5,FALSE
Ana Carolina,Rafael Ol,ô dó,0,FALSE
Tony Elton,,"Quem vai ser, LULA? ACEITA QUE DÓI MENOS",0,FALSE
José Silvério Jr.,,Ninguém leu a matéria???,0,FALSE
Mi Trindade,,Mesmo quando ele tem razão ele está errado ! Lixo,3,FALSE
Edite Sales,,Bolsonaro 2022,6,FALSE
Camila Dantas,,"Não dou razão pra político nunca, pq é isso q eles querem, eles não pouco se lixando pra gente!!",3,FALSE
Marlene Caldin,,De onde saiu esse jornal??,0,FALSE
Marcos Araujo Santos,,Vai gado!!!,1,FALSE
Alex NM,,"A imagem pode conter: 1 pessoa, texto que diz ""Pedro Penseiro @PedroLColli ""Lógica"" do bolsominion: Se os especialistas, que estudam o assunto há anos, não têm certeza sobre determinados aspectos da Covid-19 então é melhor acreditar no presidente que nunca pisou numa universidade.""",6,FALSE
Gilvani Somar Ramosprocopio,,"Estão mais perdidos que cego em tiroteio, cadê os gênios? Estamos vivendo uma prova a qual só Deus pode nos ajudar.",0,FALSE
Marcelo Expedito Soares,,"a doenca esta sendo estudada ainda, em plena pandemia",0,FALSE
Luiz Duarte,,https://m.facebook.com/story.php?story_fbid=142404497365519&id=111037913835511 OXÍMETRO de DEDO pronta entrega,0,FALSE
Corouna Esmeralda,,"Ah, coitado.",0,FALSE
Lecão AX,,"A imagem pode conter: texto que diz ""COMO USAR A CLOROQUINA BOZO TIRE DA EMBALAGEM LUBRIFIQUE Οι COLOQUE 0 BOLSOMINION NESSA POSIÇĂ ABRA O RABO RABO DELE DELE ENFIE AC CLOROQUINA NO RABO DELE MITO! LVALDAR UM GRITINHO ο""",2,FALSE
Wanda Ayala,,"A imagem pode conter: texto que diz ""Meu próximo animal de estimação vai ser um bolsominion! Pensa num bicho que defende ο dono a qualquer custo!""",2,FALSE
Arizla Villela,Wanda Ayala,Animal de estimação é um bichinho bom.leal. Não se pode cimparar com um sujeito do mau.,0,FALSE
Wanda Ayala,Arizla Villela,", por isso mesmo! Só vê o dono pela frente!  😂  😂",1,FALSE
Arizla Villela,Wanda Ayala,tem razão.kkkk,1,FALSE
Arizla Villela,,A ignorância é pior do que o covid. Cega e emburrece,0,FALSE
Maria José Dutilh Pinheiro Alves,,Só lamento,0,FALSE
Carlos Henrique,,"Ele sempre teve razão. Só que não. A imagem pode conter: 8 pessoas, texto que diz ""INÍCIO PANDEMIA ""Coronavírus é invenção da imprensa!"" 1a MORTE ""É só uma gripezinha!"" 10 MORTES ""Tenho histórico de atleta!' 100 MORTES ""Vão morrer alguns idosos!"" 1.000 MORTES ""Não sou coveiro!"" ............. 10 MIL MORTES ""E daí?"" 20 MIL MORTES governadores prefeitos! ""A culpa é dos 35MIL MORTES ""Vamos esconder 0 número mortos!""""",1,FALSE
Fabiano Capone,,"primeiro que o GRipezinha foi a globo que começou, segundo que o E dai foi um resposta a comparaçao com a CHINA e para fechar, me fala qual remedio tem nos paises de primeiro mundo que aqui nao foi usado....",0,FALSE
Larissa De Oliveira Lima,,Fora Bolsonaro Genocida,0,FALSE
Rene Verissimo,,"Nao , ele nao tem razão",0,FALSE
Edilson M Carvalho,,Parece que o Trunpp também têm razão!!! Suspendeu o uso da CLOAQUINA por lá e irá exportar para o Brasil sil sil sil o lixo tóxicos de lá.,0,FALSE