Usuário,Reply,Conteúdo,Reações,Editado
Flavio Magalhães,,"A imagem pode conter: 1 pessoa, texto que diz ""ALGAR TELECOM 23:19 google.com Segundo a ""The Lancet"", os autores foram incapazes de realizar auditoria independente dados fornecidos pela empresa Surgisphere, contratada para coletar os dados hospitais sobre os pacientes. o estudo afirmava avaliado pacientes, alguns hospitais confirmaram dados utilizados, segundo imprensa inglesa. e Apesar de boa parte da comunidade científica apontar evidências cloroquina hidroxicloroquina possam efeitos mostraram profissionais questionaram metodologia da nova enviaram uma carta ""The Lancet"" com críticas ao estudo. Após os questionamentos, os autores concluíram que ""não podem mais garantir a × esclarece duvidassobre Coronavirus +""",0,FALSE
Douglas Mello Almeidinha,Flavio Magalhães,só ir no Google acadêmico e colocar na busca cloroquina e covid-19 que vem vários,0,FALSE
Douglas Mello Almeidinha,Flavio Magalhães,"outra coisa, o reino unido já parou de perder tempo com esse remédio",0,FALSE
Flavio Magalhães,,"Ja fiz isso...umas 5x. mas ok, cada um com a sua verdade. Eu não uso um medicamento só pq o presidente quer. Prefiro arriscar sem ele. Mas tbm não quero debate. Abraço",1,FALSE
Flavio Magalhães,Douglas Mello Almeidinha,cara... Acho que vc não entendeu que eu sou contra esse remédio tbm... Kkkkk,1,FALSE
Douglas Mello Almeidinha,Flavio Magalhães,ok.,0,FALSE
Carolina Pedroso,,"Isso pelo q vi é verdade, parece q o oms ia retomar os estudos com a cloroquina. Vi algo sobre isso na globo na sexta. Tem que checar e ver se é ou não verdade.",0,FALSE
Leonardo Santos,Carolina Pedroso,"colocaram terror em médicos para não usar, intimidações na questão de perda de crm em casos de morte ...ai alguns recuaram mas alguns baseados em seus argumentos ainda que poucos usaram",0,TRUE
Carolina Pedroso,Leonardo Santos,o problema é que precisa de estudo e comprovação científica. Pelo que vi tinha saído essa pesquisa e a oms parou os testes. Agora vai voltar aos testes. Mas não tem nada de milagre.,1,FALSE
Leonardo Santos,Carolina Pedroso,"concordo com você,mas numa guerra contra o tempo alguns protocolos precisam ser acelerados, este virus veio para mostrar nossa vulnerabilidade mundialmente falando",0,FALSE
João Flávio,,Nossa mano... Vc eh mto burro,5,FALSE
Douglas Mello Almeidinha,João Flávio Gomes Faria,quem ?,0,FALSE
Diogo Fazolin,,Cloroquina faz mal pessoal... O que faz bem mesmo são as drogas  🤭,8,FALSE
Marcos Santos Santana,Diogo Fazolin,q comparação...droga sempre fez mal e vicia e altera a pessoa . Cloroquina é um remedio q tem q usar numa dosagem muito alta para matar o virus entao em muitas pessoas ele pode ate matar pq nem todos tem rins e coração saudavel.,0,FALSE
Ejay Brik Antonio,Marcos Santos Santana,Cloroquina e uma droga também.,1,FALSE
Thamara Gabriel,Diogo Fazolin,pessoas tóxicas e leigas tbm !,0,FALSE
Thamara Gabriel,Ejay Brik Antonio,"não sabe o que fala ! ""Só fala""",0,FALSE
Caroline Sant'Ana,Diogo Fazolin,kkkkkkkkkkkkk,0,FALSE
Gilberto Rodrigues,,Kkkkkkkkkkkkkkkkkkkk Existe algum idiota q realmente acredita que Bolsonaro está um passo na frente da ciência?…Ver mais,13,FALSE
Douglas Mello Almeidinha,Gilberto Rodrigues,nem em sonho,1,FALSE
Gilberto Rodrigues,Douglas Mello Almeidinha,"Fanatismo venda os olhos, normal. No esporte e segue lista. Mas é mto triste esse nacionalismo de gaveta e tupiniquim imposto pelo presidente....E convenve gde parte; até alguns instruídos...",2,FALSE
Edson Monreal,,Toma cloroquina quem quiser. E não toma quem não quiser. Meu Deus! Quanto drama por isso.,1,FALSE
Adriana Driika,,"Babaca masoquista, deveria se colocar no seu lugar.",0,FALSE
Diogo Fazolin,,"Aiii a CLOROQUINA causa arritmia... E o que aquele whisky com energético que você toma nas baladas faz? Me poupem, se médicos defendem o uso da cloroquina já no início... Se o ex Doria, o infectologista Dr. David Uip e o renomado cardiologista Dr. Rob…Ver mais",9,TRUE
Douglas Mello Almeidinha,Diogo Fazolin,o problema é que é uma arritmia severa que pode levar ao óbito por parada cardíaca!,0,FALSE
Diogo Fazolin,,E o que me diz sobre o resto do meu comentário?!?!,1,FALSE
Rafael Mazzieiro,Diogo Fazolin,"eles tomaram vários remédios, dizer que foi a Cloroquina que curou é irresponsável. A dose da Cloroquina para Covid chega a ser 3 vezes maior que o usado para outras doenças. É necessário monitoramento do paciente, eletro antes, durante e…Ver mais",1,FALSE
Jorge Pinto,,Para quem não leu - apenas retiraram uma matéria que dizia que a cloroquina matava,1,FALSE
Douglas Mello Almeidinha,Jorge Pinto,"sim, mas existem vários outros artigos que concluíram o mesmo",0,FALSE
Luiz Gonzaga,,🇧🇷,0,FALSE
Irismelo Barto,,Gente não é verdade essa medicação e muito perigosa pode causar ataque cardíaco toma cuidado com medicamentos,3,FALSE
Maria Jose Ponce Ribeiro,,"Está medicação está liberada para uso há mais de 60 anos. Usada no tratamento de lúpus, malária, .... O médico vai avaliar se o paciente pode tomar.",0,FALSE
Solange Bento,,"A imagem pode conter: texto que diz ""ESSE MEDICAMENTO PODE CAUSAR: Distúrbios cardíacos (síndrome de kounis). pode causar choque anafilático, que podem tornar graves vida em alguns casos fatais. Distúrbios sangue sistema Anemia aplástica, leucopenia EMS sulfato de hidroxicloroquina etc. Distúrbios vasculares. Distúrbios Distúrbios gastrintestinais. Distúrbios pele (síndrome de stevens-johnson) 400 mg USOORAL USOALIDEATDATR.COACMACEGAMOS G Medicamento Genérico VOCÊ ACHA QUE ACABOU DE LER BULA DA HIDROXICLOROQUINA SE ENGANOU. ESSA BULA NOVALGINA. SABE AQUELA TOMA OU FEBRINHA? Vamos parar com a hipocrisia! VENDA S0B MÉDICA Contém 30 comprimidos avestidos""",1,FALSE
Jane Arruda de Siqueira,Solange Bento,Eu jamais poderia tomar!!,0,FALSE
Jane Arruda de Siqueira,Irismelo Barto,"E ainda, o Sr Trump, dizer que toma cloroquina como prevenção do Covid!! Mentira! Ele é dono da indústria da droga. E o bossal de cá, vende esse peixe, mancomunado com o fabricante.",0,FALSE
Diogo Fazolin,,Quem é o gado?!?! Teste positivo para mamão e bode?… Ver mais Tanzânia revê testes de coronavírus após bode e mamão testarem positivo SBT.COM.BR Tanzânia revê testes de coronavírus após bode e mamão testarem positivo Tanzânia revê testes de coronavírus após bode e mamão testarem positivo,4,FALSE
Alexandre Correia,,Já foi verificado e ocorreu erro na manipulação dos testes.,0,FALSE
Erik Tavares,,O presidente mandou fazer os testes para desacreditar cientistas e curar COVID com garrafada.,0,FALSE
Patricia Nogueira,,"Queria sinceramente que o presidente tivesse razão pelo menos 1 vez, mas não é o caso e nunca foi.",7,FALSE
Fabiane Lima,,Eles voltaram a fazer testes. Não significa que o medicamento funciona.,6,FALSE
Maria Isabel,,Reproduzir GIF GIPHY,1,FALSE
Maria Isabel,,Reproduzir GIF GIPHY,2,FALSE
Diogo Fazolin,,media1.tenor.co,0,FALSE
Rafael Mazzieiro,Diogo Fazolin,"o único argumento para Bolsonarista é o PT  🙄 vamos discutir idéias e parar de idolatrar político, PT e Bolsonaro possuem interesses próprios.",4,FALSE
Jessica Damasceno,Rafael Mazzieiro,Eles não tem capacidade de fazer um argumento coerente,2,FALSE
Cristiane Montanari,Diogo Fazolin,adoro  🥰 com um pãozinho fresco kkk nossa delícia,1,FALSE
Bob Silva,,"Cloroquina é a fake news da morte institucionalizada do governo Bolsonaro. Nesse governo de marginais milicianos, dos testas de ferro do crime organizado das lavanderias fiscais das igrejas, dos agentes da CIA maquiados de líderes religiosos, dos mili… Ver mais Carlos Wizard diz que governo deve investir R$ 30 milhões em cloroquina - CartaCapital CARTACAPITAL.COM.BR Carlos Wizard diz que governo deve investir R$ 30 milhões em cloroquina - CartaCapital Carlos Wizard diz que governo deve investir R$ 30 milhões em cloroquina - CartaCapital",5,FALSE
Vanessa Soares,Bob Silva,"infelizmente não adianta falar com quem não quer entender. Afinal, pra eles, é o mundo inteiro que está errado e só Bolsonaro está certo.",0,FALSE
Andrew Oliveira,,"Amig@ não passe vergonha! As desculpas são pelo encerramento total de pesquisas. Isso sim é um erro. Acreditar que Bilorilo é acertivo são outros quinhentos... Bem burros, por sinal!",15,FALSE
Luana Lucietto,,"Ah sim, o médico presidente tem razão  🤢",5,FALSE
Vanessa Soares,Luana Lucietto,afinal não dá pra contestar quem está voltado a só acreditar no Bolsonaro. #ForaBolsonaro,2,TRUE
Gilberto Rodrigues,,Acooooorda galera. Pelamor!!!!! Sem fanatismo. Encarem racionalmente.,3,FALSE
Carlos Avezzu,,mais uma vez (me mata de rir  🤣  🤣  🤣 ) país dos jumentos!!!,9,FALSE
Leonardo Maues,,👏  👏  👏  👏  👏,0,FALSE
José Dias,,Não. A cloroquina continua fora. Apenas a hidroxicloroquina deve ser usada em testes. Testes! Não uso.,7,FALSE
Tadeu Fernandes,,Bastou Trump querer tirar investimentos que a OMS vai pesquisar mais?!,1,FALSE
Amisterdan Chagas,,Bota o gado pra ser Cobaia,5,FALSE
Maurício Tadeu Silva,Amisterdan Chagas,precisa não ja ta sendo testada em jumento,2,FALSE
Fatima Stoppelli,,"Só ele tem razão, o mundo está errado, os cientistas. O medicamento não foi feito pra esse vírus, tem que ser dosado e o paciente monitorado, pois as doses são altas pra matar o vírus, por isso os efeitos colaterais",3,FALSE
Manyy Moura,,"A imagem pode conter: 1 pessoa, texto que diz ""ALÔ BOLSONARISTAS: Fake News não é liberdade de expressão Organização criminosa não é militância politica""",3,FALSE
Jane Arruda de Siqueira,,"Incrível como tem pessoas que acreditam em qualquer coisa, mesmo que seja explicado exaustivamente.",5,FALSE
Rodrigo Andreazi,,"Não disse nem que sim nem que não. Nada provado. Segura a emoção, nelores do Brasil",4,FALSE
Fabiano Capone,,"E tem imbecil que não gosta do Bolsonaro. Por isso o Brasil perde, pelo grande número de imbecis que ainda esperam a volta dos políticos corruptos que os mantém com bolsa esmola.",9,FALSE
Bruna X Fernando,Fabiano Capone,Se vc tiver for um.pouco inteligente não vai ser ladrão nem miliciano.,3,FALSE
Fabiano Capone,Bruna X Fernando,"os ladrões ja deveriam estar presos, os milicianos se alguém provar tudo bem, por enquanto é só piada.",0,TRUE
Mônica Pinheiro Fernandes,,"A imagem pode conter: uma ou mais pessoas, texto que diz ""Florestan Fernandes. 5min Em 1971, em plena ditadura, os militares ocultaram da população a epidemia de meningite. A omissão levou ao avanço da doença por longos 5 anos. Agora, Bolsonaro e seus generais escondem os números de vítimas da Covid-19 Para matar as saudades dos saudosistas.""",9,FALSE
Thais Costa,,Claro q o burro vai querer enfiar Cloroquina né nos jumentos até pq ele gastou milhões né povo burro senhor me der paciência  🤦  🙆  🐂,11,FALSE
Fabiano Capone,Thais Costa,roubar em respiradores e hospitais de campana pode...kkk,0,FALSE
Fabiano Capone,,"A imagem pode conter: ‎2 pessoas, ‎óculos, ‎texto que diz ""‎Ou o DOTO não funciona, ou o vírus não gosta de queijo com cachaça! SEM MISOLAMENTO MINAS GERAIS 255 ÓBITOS @LINCOLNDRUMONDM COM ISOLAMENTO SÃO PAULO 6.980 ÓBITOS ن‎""‎‎‎",1,FALSE
Fabiano Capone,,"A imagem pode conter: 10 pessoas, pessoas em pé, texto que diz ""Estamos a mais de 500 dias sem roubar!""",1,FALSE
Fabiano Capone,,"A imagem pode conter: comida, texto que diz ""Usamos os melhores ingredientes ntes em NOSSOS LANCHES! #MELHORE #MELHORES LaBellicia LaB icia COZINHA ARTESANAL""",1,FALSE
Fabiano Capone,,"A imagem pode conter: texto que diz ""se eu disser disser que foi o covid-19 vocês acredita 0""",1,FALSE
Fabiano Capone,,0:00 / 0:46,1,FALSE
Fabiano Capone,,0:00 / 0:46,1,FALSE
Amélia Carmo,Thais Costa,"A imagem pode conter: 8 pessoas, texto que diz ""INÍCIO PANDEMIA ""Coronavírus é invenção imprensa!"" 1a MORTE ""É só uma gripezinha!"" 10 MORTES ""Tenho histórico de atleta!"" 100 MORTES ""Vão morrer alguns idosos!"" 1.000 MORTES ""Não sou coveiro!"" ............ 10 MIL MORTES ""E daí?"" ""A culpa é dos governadores prefeitos!"" 20 MIL MORTES 35MIL MORTES ""Vamos esconder o número mortos!""""",3,FALSE
Thais Costa,Amélia Carmo,É bem isso viu  😂  😂  😂,1,FALSE
Thais Costa,Amélia Carmo,Esse cara um lixo e nem discuto mais com quem é a favor dele é perca de tempo. Rs,1,FALSE
Thais Costa,Fabiano Capone,FAKE querido isso foi comprovado  🙄  🙄,1,FALSE
Thais Costa,Fabiano Capone,"A imagem pode conter: texto que diz ""Discordar do presidente não significa apoiar o PT. Existe vida inteligente além dessa disputa.""",1,FALSE
Fabiano Capone,Thais Costa,você indica quem para ser Presidente do Brasil?,0,FALSE
Fabiano Capone,Amélia Carmo,fazer piada é fácil.,0,FALSE
Fabiano Capone,,"A imagem pode conter: texto que diz ""Já perceberam que não houve mortes em massa de caixas de supermercado, entregadores de pizza e funcionários do transporte público por conta do COVID19? Ou a doença não é tudo isso, ou eles são alienígenas.""",0,FALSE
Fabiano Capone,,Nenhuma descrição de foto disponível.,0,FALSE
Fabiano Capone,,0:00 / 0:29,0,FALSE
Fabiano Capone,,"A imagem pode conter: 1 pessoa, texto que diz ""6:20 Instagram há 19 horas gabrielmonteiropm São Paulo GABRIEL MONTEIRO CAOS EM SAO PAULO DESEMPREGO DISPARANDO MAIOR NÚMERO DE MORTES POR CORONA VIRUS DO PAIS (28x MAIS QUE MINAS PROMOTORIA INVESTIGANDO SUPERFA AMENTO EM COMPRAS DE R$ 500 MILHÕES EM EM RESI RESPIRADORES GABRIELMONTEIRO GMONTEIRORJ""",0,FALSE
Thais Costa,Fabiano Capone,Só tem meme é  😂  😂  😂,1,FALSE
Amélia Carmo,Fabiano Capone,ate o terraplanista idiota esta pulando do barco 0:00 / 2:15,1,FALSE
Fabiano Capone,,"A imagem pode conter: ‎2 pessoas, ‎óculos, ‎texto que diz ""‎Ou o DOTO não funciona, ou o vírus não gosta de queijo com cachaça! SEM MISOLAMENTO MINAS GERAIS 255 ÓBITOS @LINCOLNDRUMONDM COM ISOLAMENTO SÃO PAULO 6.980 ÓBITOS ن‎""‎‎‎",0,FALSE
Thais Costa,Fabiano Capone,😴  😴  😴  😴  😪  🙈  🙉  🙊,1,FALSE
Thais Costa,Fabiano Capone,Indico vc pra ser presidente.,1,FALSE
Fabiano Capone,,"Vocês só fazendo piada que entendem. Falar sério depois de ver as besteiras que falam, realmente é perca de tempo.",1,FALSE
Thais Costa,Fabiano Capone,Ué o presidente faz pq eu não posso fazer,1,FALSE
Fabiano Capone,,"E ainda falam que é o Mito que fala besteira...faz favor, conta outra.",1,FALSE
Fabiano Capone,Thais Costa,porque vc não é. Simples assim.,0,FALSE
Thais Costa,Fabiano Capone,Meu querido o presidente vive fazendo piadas até com as vidas e vcs é a favor dele e pq vou falar sério com vcs por favor né,0,FALSE
Fabiano Capone,Thais Costa,"pra ser presidente precisa aguentar a ignorância do povo falando o que pensa sem ajudar em nada .. tem fora. Mas já que vc não é da petezada filha da puta, indica um presidente que vc acredita ser bom ..rs",0,FALSE
Thais Costa,Fabiano Capone,Vcs é desgastante tem q rir fazer piada vamos discutir sobre oq  🤷,1,FALSE
Thais Costa,Fabiano Capone,Né e a burrice de muitos.,1,FALSE
Fabiano Capone,Thais Costa,qual piada ele fez com vidas?,0,FALSE
Thais Costa,Fabiano Capone,"Vc está me xingando vc sabe q isso dar processo né, mas não fico admirada não olha a classe q vc é né.",1,FALSE
Thais Costa,Fabiano Capone,Tá vendo a pergunta q vc fez qual piadas eles fez com vidas? É desgastante falar com gente burra. Kkkk,0,FALSE
Fabiano Capone,Thais Costa,vai estudar e aprender interpretação de texto...kkkk ou vc é petista agora???,0,FALSE
Thais Costa,Fabiano Capone,Não temo nem ministro da saúde cara vc quer discutir oq por favo né para de passar vergonha.,1,TRUE
Fabiano Capone,,"Me processa vai lá, tô implorando...kkkk",0,FALSE
Fabiano Capone,,Aprenda sobre conjugação verbal tbm...,0,FALSE
Thais Costa,Fabiano Capone,Kkkk vc está longe de mandar eu estudar né querido  🐂  🐂  🐂  🐂,0,FALSE
Thais Costa,Fabiano Capone,Meu amor com pessoas igual a vc não faço nenhum esforço pra escrita de vdd.,0,FALSE
Fabiano Capone,,Você me chama de burro? E fala em processo? Onde eu te xinguei?,1,FALSE
Fabiano Capone,,Imbecil. Ignorante.,1,FALSE
Fabiano Capone,,Mobral,1,FALSE
Fabiano Capone,,Agora eu te xinguei...e fodasse. Volta pra escola e para de falar merda e passar vergonha.,0,FALSE
Thais Costa,Fabiano Capone,Não tenho tempo pra tipinho de gente igual a vc não eu trabalho sabe se é que vc saiba oq é isso né trabalho.,0,FALSE
Fabiano Capone,Thais Costa,nem me comparo com gentinha,0,FALSE
Thais Costa,Fabiano Capone,Vá procurar um trabalho cara menti vazia é oficina do diabo. Kkkkkk,1,FALSE
Fabiano Capone,,"Trabalha? Bom antes de vc trabalhar eu estudei me formei e trabalho a mais de 30 anos...e isso não é da sua conta, estávamos falando sobre o Presidente e você não sabe escrever nem ler o que eu escrevo...bem esse o perfil da esquerdalha.",0,FALSE
Thais Costa,Fabiano Capone,Deixa eu trabalhar viu gado,0,FALSE
Thais Costa,Fabiano Capone,Grande merda sua formação prestou pra que  🤷  🤷  🤷,0,FALSE
Fabiano Capone,,Trabalhadora...kkmm,0,FALSE
Thais Costa,Fabiano Capone,Tenho nada pra falar desse lixo desse presidente e nem com quem é a favor dele.,0,FALSE
Thais Costa,Fabiano Capone,Concerteza querido e trabalho pra mim viu tenho o meu negócio.,1,FALSE
Thais Costa,Fabiano Capone,Trabalho pra ninguém não viu a burra  😂  😂  😂  😂,1,FALSE
Fabiano Capone,Thais Costa,"tá acima o que precisei falar...agora fica aí ""trabalhando"" pra me dar retorno e enquanto isso eu vou curtir meu domingo, porque trabalho pra mim é de segunda a sábado.",0,FALSE
Thais Costa,,"A imagem pode conter: texto que diz ""ELEITOR DE BOLSONARO É IGUAL A CORNO: A GENTE MOSTRA FOTO, MOSTRA VÍDEO E, NO FIM DAS CONTAS, PERDE UM AMIGO...""",1,FALSE
Thais Costa,Fabiano Capone,Vá dormi louco  😂  😂  😂,1,FALSE
Fabiano Capone,,"Quem trabalha, trabalha para alguém, mesmo que não seja para o patrão, será para o cliente, paciente etc.",0,FALSE
Thais Costa,Fabiano Capone,Pausar GIF GIPHY,1,FALSE
Fabiano Capone,,"A imagem pode conter: texto que diz ""NÃO SOU PETISTA MAAAS... PT""",1,FALSE
Thais Costa,Fabiano Capone,Solta meu anjo querido oxi qual o seu problema. Kkkk,1,FALSE
Thais Costa,Fabiano Capone,Pausar GIF Tenor,1,FALSE
Fabiano Capone,,"A imagem pode conter: texto que diz ""Tem gente que diz ser cabeça aberta... E deve ser verdade. Tão aberta que o cérebro aproveitou e pulou fora.""",0,FALSE
Fabiano Capone,,Nenhuma descrição de foto disponível.,0,FALSE
Thais Costa,Fabiano Capone,Reproduzir GIF GIPHY,1,FALSE
Fabiano Capone,Thais Costa,Xonou?,1,FALSE
Thais Costa,Fabiano Capone,Solta meu anjo.,0,FALSE
Thais Costa,Fabiano Capone,Xonou por quem nojento  🤢  🤢,1,FALSE
Fabiano Capone,,Pausar GIF Tenor,0,FALSE
Alex NM,Fabiano Capone,"você indica quem para ser Presidente do Brasil? Que assuma o Mourão. Para isso serve um vice presidente. Mas já sei, vc não vai concordar, pois prefere alguém do Centrão, certo? Reproduzir GIF Tenor",0,TRUE
Evelyn Cristina,Patricia Fiorenttino,olha isso,0,FALSE
Amélia Carmo,,"A imagem pode conter: 3 pessoas, pessoas sentadas, texto que diz ""BOLSONARO É UMA ESCÓRIA PRA HUMANIDADE Governo tira R$ 83 milhões de programa contra extrema pobreza no Nordeste e realoca para publicidades na SECOM FONTE NTE:METROPOLES""",9,FALSE
Mário De Melo,,"Meu Deus, ela ainda não entendeu que não pode ser usada?",3,FALSE
Mário De Melo,,Partiu curar o mundo agora?,0,FALSE
Luciano Souza Almeida,,"Povo burro , fanáticos e doentes.",2,FALSE
Rose Brayan Martins,,Gente parem de brigar por causa disso... Quem não quiser tomar o remédio espera a remessa de vacina grátis lá dá China  😁  👍,1,TRUE
Vinicius Schiezaro,Rose Brayan Martins,ou você pode tomar e ter um infarto e MORRER como quase aconteceu com meu cunhado.  😃  👍,6,TRUE
Celia Maria Sikorski,Vinicius Schiezaro,"DIPIRONA tbm infarta. Concordo com vc Rose Brayan Martim, é tanta briga, mas eu prefiro ficar com a dra. Nise Yamaguchi, dr. Wong, dr. Marcos Andrade, dr.Marcos Menelau e tantos outros que estão salvando vidas usando a CLOROQUINA.",2,FALSE
Vinicius Schiezaro,Celia Maria Sikorski,corre lá! Alguém tá te impedindo?,0,FALSE
Celia Maria Sikorski,Vinicius Schiezaro,🤦,0,FALSE
Luciano Souza Almeida,,Eita povo fanático.  😂  😂,0,FALSE
Quelis Brito,,"Isso não invalida os resultados anteriores que foram bem conduzidos, que foram publicados nas outras revistas, e todos indicam para o não funcionamento da hidroxicloroquina, com a azitromicina ou sem, destaca Pasternak. ""As conclusões que a gente tem…Ver mais",9,FALSE
Fernanda Oliveira,,Gado vai tomar,4,FALSE
Rodrigo Cunha,,O único estudo A FAVOR foi retirado do ar. Continuem aí bostejando bando de gado.,13,FALSE
Eidi Margani,,“Mais uma vez”  🤣  🤣  🤣,2,FALSE
Andreia Macedo,,Covid-19 ainda não tem cura!,2,FALSE
Fernanda Oliveira,Andreia Macedo,"bovid 17 é pior,ta doido povo louco",2,FALSE
Dina Maria,,"Só bolsonazi tem o conhecimento, o resto do mundo está perdendo por não ter a inteligência dele...",9,FALSE
Iury Camargo,Dina Maria,kkkkkkkkkkk Cientistas e médicos do mundo inteiro que estudaram a vida toda dizem que cloroquina não presta e só o Bolsonazi tá certo kkkkkk,1,FALSE
Dina Maria,Iury Camargo,gênio ele!!!! A gente que não valoriza o presidente que tem!,0,FALSE
Leide Menezes,,Quanta ignorância,1,FALSE
Camila Juliana de Moraes,,"Por mim q enfiem cloroquina até no cu e morram.... tenho Lúpus eritematoso sistêmico e não consigo mais encontrar o medicamento por causa desse bando de FDP q saiu comprando  😠 na minha cidade nenhuma farmácia tem, uma amg já está sem... Quem realmente …Ver mais",19,FALSE
Lene Costa,Camila Juliana de Moraes,"quem mandou suspender o remédio foram os governadores, cobra o governador da sua cidade.....",0,FALSE
Elaine Teixeira,Camila Juliana de Moraes,eu tenho visto pessoas falando que vão tomar por precaução!,1,FALSE
Elaine Teixeira,Lene Costa,"não fia foi a OMS ok. Pq o uso estava descontrolado, tem pessoas tomando por precaução!",1,FALSE
Camila Juliana de Moraes,,"Independente de quem mandou suspender foi por quem saiu comprando sem precisar.... Já cobrei td mundo q tinha pra cobrar e falaram ""não podemos fazer nada""...",1,FALSE
Lene Costa,Elaine Teixeira,"mais os governadores também, tudo combinado,nāo aceitaram o decreto para o uso....",0,FALSE
Iury Camargo,Elaine Teixeira,suspenderam o uso para quem nao é indicado!!,2,FALSE
Elaine Teixeira,Iury Camargo,foda q tem gente tá tomando por precaução  🙄,0,FALSE
Giane Fernandes,Lene Costa,"claro q não, qual a comprovação científica de que funciona? Pelo amor de Deus!",1,FALSE
Elisabete Martins,,Fake,1,FALSE
Elaine Teixeira,,Kkkkkkk e dá-le cloroquina no fiofó de td mundo.,1,FALSE
Madalena Andrade,,"A imagem pode conter: texto que diz ""os ""PROBLEMAS"" DA CLOROQUINA NÃO TEM PATENTE! que não dá muito lucro para grandes indústrias",7,FALSE
Marcos Santos Santana,Madalena Andrade,eua se livrou de uma grande carga e mandou para o brasil q quer muito usar.,1,FALSE
Beatriz Lins,,O verdadeiro chupador de rola de Bozo,7,FALSE
Chidemar Franklin,,#ForaMaia #foramaia . #forarodrigomaia #foratoffoli …Ver mais,3,FALSE
Eulália Alves Fogaça,Chidemar Franklin,0:00 / 0:08,0,FALSE
Camila Pavan Suzuki,,"Pelo menos o pt pagava 50 reais p povo passar vergonha, já vocês passam vergonha de graça!",0,FALSE
Marco Aurelio Cattani,,"- Ô suas antas analfabetas, os cientistas pediram desculpas por terem se baseados em estudos inconclusivos e declarado que a “corociclina” seria eficaz contra o Covid-19, como alardeava o genocida esquisofrênico do Bolsonaro  💀 !",21,TRUE
Carolina Pedroso,Marco Aurelio Cattani,tem nada disso. Apenas vão continuar os estudos. Pega e já vai tomando a cloroquina. De repente te ajuda!!!!,4,FALSE
Jack de Jesus,,"Estudos são assim, precisam ser analisados e comprovados por cientistas antes de afirmar com tamanha certeza. Não é um besta leigo que tem razão de nada.",0,TRUE
Jeanne Gonliver,,efeitos colaterais da cloroquina ainda são alvos de estudo,0,FALSE
Gilberto Rodrigues,,"Cloroquina nao foi desenvolvida para salvar o homem, em que pese com avanço da cielncia possa ser utilizada para esse fim. Cloroquina é usada pra salvar esse desgoverno. Qto mais mortes de idosos menos aposentadoria pro governo pagar. …Ver mais",8,FALSE
Marcos Santos Santana,Gilberto Rodrigues,fato,1,FALSE
Tony Elton,,"E a China fica onde? Homem, tmnc. Tudo é culpa do governo, até a irresponsabilidade estrangeira.",0,FALSE
Gilberto Rodrigues,,"Bolsonaro, calado tá errado. Ele e sua tropa de zumbis fanáticos...",0,FALSE
Maria Regina Rê,,"Meu filho mora na Dinamarca e lá o Governo suspendeu as pesquisas com o cloroquina, chegaram a conclusão que só piora!",6,FALSE
Douglas Mello Almeidinha,Maria Regina Rê,só aqui que o governo fica dando murro em ponta de faca,3,FALSE
José Artur de Souza,Maria Regina Rê,Nenhuma descrição de foto disponível.,1,FALSE
Kelly Yllek,Maria Regina Rê,no Reino unido estão fazendo estudos https://www.dw.com/es/reino-unido-testean-f%C3%A1rmaco-contra-la-malaria-para-combatir-el-coronavirus/a-53525047 Reino Unido: testean fármaco contra la malaria para combatir el coronavirus | DW | 21.05.2020 DW.COM Reino Unido: testean fármaco contra la malaria para combatir el coronavirus | DW | 21.05.2020 Reino Unido: testean fármaco contra la malaria para combatir el coronavirus | DW | 21.05.2020,0,FALSE
Jessika De Moura Rego Mello,,#ForaBolsonaro,0,FALSE
Tony Elton,Jessika De Moura Rego Mello,teu cu,0,FALSE
Dias Alm DE Itaóca-sp Ozias,Essa cloroquina ajuda no exterminio da população,5,0,FALSE
Fabiano Capone,Dias Alm DE Itaóca-sp Ozias,você tem alguma outra alternativa que funciona?,2,FALSE
