content,stance
"Tô confiante nesse medicamento não só aqui como em vários países estão fazendo testes.. inicialmente são só os casos graves que estão usando afinal ainda não se sabe se compensa, muito estudo pra sair ainda mas pelo menos já é uma luz",Positivo
Gente cheia de mimimi a mulher falo que foi curada com o remédio é pq o remédio é bom pensam mais em criticar o bolsonaro do q na saude e recuperação dos outros são capaz de torcer contra,Positivo
verdade  🙏,Positivo
"o Bolsonaro pode não ser o melhor presidente q o Brasil teve mais parece q tudo o que ele fala é motivo pro povo criticar ele pode ta falando a coisa certa mais pro povo ta sempre errado, não é hora de discutir politica e sim de pensa… Ver mais",Positivo
gente o cloroquina nao faz efeito sozinho não tem a dosagem correta e outros dois medicamentos só não irei falar qual é. Porém o povo ta saindo tomando o cloroquina sem prescrição e sem necessidade achando que vai combater o vírus. Quando… Ver mais,Positivo
mais eu não falei em momento algum em auto medicarmos estou falando q graças a Deus a gente tem uma esperança,Positivo
sim concordo plenamente,Positivo
"O Brasil é um país quente então o que pode está acontecendo é que o vírus não está chegando aqui com tanta força quanto está na Itália por exemplo , bem é o que penso e o que espero que seja . Peço a Deus que guarde as vidas de todos ...",Positivo
"Nós primeiros meses o vírus se contaminou duas vezes mais do que a Itália em testes confirmado, e também não existe qualquer correlação entre o clima com o vírus se espalhar",Negativo
Isso é apenas desculpa pra quem é contra a quarentena,Negativo
"esse é só o meu pensamento , não sou contra a quarentena tenho mãe com mais de 65 a os filhos pequenos e estou desempregada . Esse como eu disse é meu pensamento como cada um tem o seu .",Positivo
"e outra quem sabe do certo ou errado a não ser Deus , não sou eu nem você !",Positivo
"Quem sabe do certo e o errado é a ciência, e todas as pesquisas demsotra que se não tiver um isolamento horizontal, terá um colapso dentro da saúde onde muitos irão morrer",Negativo
"Os que querem causar pavor para lucrar com o vírus estão pirando com a cloroquina. Até tirar o datena do ar hoje tiraram. Tem gente poderosa por trás desse ""caus anunciado""",Positivo
"A palavra correta é caos, tá ok",Neutro
"como assim ? Hj eu não vi, tiraram do ar?",Positivo
tiraram a tv do ar apagou tudo.,Positivo
Estranhamente,Positivo
"Eke explicou detalhadamente tudo. Até as dosagens. Quando de uma vez retiraram do ar. Bem estranho. Mas para um bom entendedor meia palavra basta. A cloroquina mata o vírus quando infectado , fazendo tratamento simples no hospital. Só não pode se autom… Ver mais",Positivo
mats o vírus em um tratamento simples de 6 dias. Com baixas dosagens da cloroquina. Rápida e prática,Positivo
"Talvez tiraram pq ele tava dando dosagem, do jeito q o povo é vai se matar tomando isso, até acredito que funcione mas não tomando de qualquer jeito, e deve envolver peso também pra ver dosagem.",Neutro
eu tava assistindo!!!!! E alguém tava infernizando ele nas mensagens enquanto ele lia a entrevista. Quando caiu o sinal eu até pensei q fosse minha antena que tá ruim kkkkk,Positivo
isso mesmo. Ele saiu do ar quando ameaçou falar o nome da pessoa,Positivo
para ter efeitos colaterais tem que tomar por anos. O tratamento do corona vírus é rápido e simples. Entenda. Derruba muitas patentes trilhonarias. Altos volumes de dinheiro mundial.,Positivo
Poxa não contaram pra Espanha nem pra Itália não é mesmo?,Neutro
"ja estão fabricando em massa, todos os países. Mas não peça fontes ou links. Procure se informar. Estou cansado de tentar alertar os inocente e emocionados....paz",Positivo
ÓTIMAS NOTÍCIAS !!!!! ENTREVISTA COMPLETA SOBRE A CLOROQUINA QUE SUBITAMENTE SAIU DO AR NO DATENA COM DR DIDIER RAOULT TRADUZIDA PARS PORTUGUÊS. … Ver mais,Positivo
"disse tdo, a cura para esse vírus custa muito para alguns grandões.",Positivo
Esse médico foi o que publicou o artigo publicando vários erros metodológicos,Negativo
"Ele não provou em nada que cloroquina funciona, o artigo dele não tem qualquer eficácia científica. Não confiem em falsa esperança, isso pode ser ruim pra vocês, espere o resultados dos estudos clínicos",Negativo
apresente uma idéia melhor e pare de criticar. Quem não soma não conta e quem não conta não faz falta. Inocente..... A indústria mundial de medicamentos e vavinas vsi oerder TRILHÕES DE EUROS se a cloroquina funcionar. Vc acredita … Ver mais,Positivo
"Mario, a ""cura"" eficaz é uma vacina, e a melhor ideia atualmente é isolante social, isso já é algo já muito bem estabelecido que só é rejeitado por pessoas egoísta",Negativo
Você não sabe por na cabeça que não existe NENHUMA prova que esse medicamento é eficaz,Negativo
"Vários países estão fazendo teste, mas entrar no modo em pesquisas clínicas desse medicamento não quer dizer que ele tá funcionando A ""taxa de sucesso"" em pessoas não é nada do que relato anedótico",Negativo
"O artigo que esse sujeito publicou é totalmente falho em metodologia científica Ele só usou 36 pacientes e não usou o duplo cego, não teve controle na quantidade de pessoas que foram curadas, não se sabe se foi curada pelo seus sistema imune ou pelo m… Ver mais",Negativo
"Na Espanha estão usando 3 mil paciente dividida em 3 grupos Uma com a cloroquina, um com outro medicamente viral, e outro com algum medicamento falso, onde os que irão aplicar o medicamento não vai saber qual medicamento vai até aplicando, e Obiviame… Ver mais",Negativo
Depois relaiza a pesquisa pra ver se o medicamento pode fazer um efeito colateral pior do que o patogeno Essas pessoas que estão se submetendo com esse medicamento não passam de cobaias de testes,Negativo
fale.para o datena kkkk,Positivo
Datena é virologista ou farmacêutico por acaso?,Negativo
"A imagem pode conter: texto que diz ""81% Julio Hoje 11:18 22:29 em-aventurados os que andam passeando à toa na rua, em breve eles verão o Senhor. Teimosos 1.1""",Positivo
desespero,Neutro
Gente parem com isso a Cloroquina já anda fazendo vítimas!!,Negativo
abraça. A cloroquina mata o vírus,Positivo
"Vai fazer vítima se pessoal resolver tomar em casa, tem muito estudo pra sair ainda.",Positivo
https://tribunadejundiai.com.br/saude/coronavirus/coronavirus-anvisa-alerta-sobre-uso-de-hidroxicloroquina-e-cloroquina/  Coronavírus: Anvisa alerta sobre uso de hidroxicloroquina e cloroquina TRIBUNADEJUNDIAI.COM.BR Coronavírus: Anvisa alerta sobre uso de hidroxicloroquina e cloroquina Coronavírus: Anvisa alerta sobre uso de hidroxicloroquina e cloroquina,Negativo
https://tribunadejundiai.com.br/saude/coronavirus/coronavirus-anvisa-alerta-sobre-uso-de-hidroxicloroquina-e-cloroquina/  Coronavírus: Anvisa alerta sobre uso de hidroxicloroquina e cloroquina TRIBUNADEJUNDIAI.COM.BR Coronavírus: Anvisa alerta sobre uso de hidroxicloroquina e cloroquina Coronavírus: Anvisa alerta sobre uso de hidroxicloroquina e cloroquina,Negativo
Uma coisa eu já sei o vírus altera a genética e a Cloroquina ainda não é a cura somente há a melhora dos infectados então os sintomas podem voltar!!,Neutro
"São promissores mas ainda está sendo estudado e estudado na marra, comprar e tomar em casa é suicídio mas conforme seguirem os testes pode sim ser aceito o uso, o vírus é novo tá tudo sendo testado agora,nada é plenamente seguro e nem eficaz.",Neutro
Sim pra ser cura segue todo um protocolo de testes e tem que estar registrado!!,Neutro
"cura eu não acho q isso seja não, confio que seja um tratamento que pode diminuir muito as mortes mas cura, não.. cura seria uma vacina isso no Max será paleativo, mas se já evitar a morte está de ótimo tamanho",Neutro
Tipo meu irmão recebeu a receita de uma pomada que me pareceu muito boa mais quem receitou foi um médico cubano em 2018 aí no Brasil a gente não encontrou pois não tinha a liberação nem registro da Anvisa então aqui não é vendido!,Neutro
"disse tudo . . não para tomar em casa e sim no médico responsável ...pessoal as vezes é sem noção ..tem que desenhar ...se tem uma solução ,vamos torcer gente ..pelo amor de Deus",Neutro
"Esse remédio está em teste, ficam ai com história e morrer intoxicado",Negativo
ninguem aqui ta falando em tomar em casa mais se eles estão dando nos hospitais é pq sabem q pode ser bom,Positivo
pra saberem se é bom para entrar como protocolo para o Coronavirus tem que ser testado en vários pacientes. Na página do Sírio Libanês está escrito que pode demorar até 90 dias. O problema é que muita gente foi nas farmácias e acabou com o estoque de Cloroquina e estão tomando sem receita médica... e tá faltando pra quem realmente precisa... tenho uma amiga que tem Lupus e não tá encontrando...  🙁,Negativo
dai vai da consciencia de cada um neh infelizmente a gente vive num pais em q não existe humaninade e consideração com o próximo nesse momento tinhamos q ser solidarios uns com os outros mais o q vejo é a lei do quem pode mais chora menos,Neutro
infelizmente as pessoas estão longe de ter consciência e muito menos pensar nos outros,Neutro
vdd,Neutro
"está em teste sim e só vai ser usado se o médico achar viável, ninguém vai sair usando sem prescrição. Pelo amor de Deus minha gente, não tomem remédio sem prescrição médica e sem necessidade.",Neutro
mais dó jeito que o povo aqui é doido,Neutro
"o remédio já existe para malária, lúpulo etc.. e está sendo usando para o corona vírus com sucesso, no Brasil, EUA, etc.. até na China foi usado.",Neutro
"Brasileiro não tem consciência, esses meses que acabaram com o estoque dos remédios, são os mesmos que acabaram com o estoque do álcool!!!",Neutro
https://tribunadejundiai.com.br/saude/coronavirus/coronavirus-anvisa-alerta-sobre-uso-de-hidroxicloroquina-e-cloroquina/  Coronavírus: Anvisa alerta sobre uso de hidroxicloroquina e cloroquina TRIBUNADEJUNDIAI.COM.BR Coronavírus: Anvisa alerta sobre uso de hidroxicloroquina e cloroquina Coronavírus: Anvisa alerta sobre uso de hidroxicloroquina e cloroquina,Negativo
Giselle Teixeira,Neutro
🙏🏻,Positivo
Deus é poderoso maravilhoso,Positivo
Pensei que foi a Cloroquina,Negativo
e Deus acima de tudo para quem tem fé,Positivo
Então por que tomou remédio? era só ter ficado rezando,Negativo
se ti não tem fé não acredita em Deus é sua opinião querida eu acredito em Deus ele é poderoso em dar a cura com um medicamento,Positivo
E por que não deu pros outros milhares de mortos?,Negativo
cada um com sua opinião,Positivo
"Mas as pessoas estão morrendo, isso não é opinião, isso é FATO.",Negativo
Só te digo uma coisa Deus é poderoso,Positivo
gente deixa as pessoas ter fé se vc nao tem fique em paz.,Positivo
infelismente tem pessoas que não tem amor a si próprio eu tenho minha fé em Deus....sempre,Positivo
"Daiane, é isso mesmo,temos que ter fé, fazemos a nossa parte e Deus faz a dele.",Positivo
sempre  🙏  ❤  🙏  ❤,Positivo
a mulher que foi entrevistada na Record falou que orava muito e o ar vinha o oração é a chave da Vitória  😉,Positivo
"Não estou impedindo ninguém de ter fé, só estou dizendo um fato, a doença esta matando geral pelo mundo.",Negativo
"Isso porque estamos falando de uma unica e nova doença, fora as trocentas outras...",Negativo
se vc não tem fé deixa para quem tem ok Deus acima de tudo.....,Positivo
"Certo, fiquem ai fingindo que estão fazendo alguma coisa, é bem comodo.",Negativo
Vc só pode estar de brincadeira não é uma foto sensual que vai te fazer milagres,Positivo
"As suas que fazem né, suas fotos e rezas impedem a fome mundial.",Negativo
kkkk,Neutro
Eu tenho meu Deus poderoso que nunca me abandonou e sempre vai estar comigo bjos querida.,Positivo
"Vamos rezar para acabar com a fome no mundo então, porque o mundo esta precisando.",Negativo
menina o remedio esta tendo pequenas comprovações agora a doença esta cada vez sendo melhor estudada a fé ajuda sim ate o psicólogo das pessoas cada vez vai morrer menas pessoas por que a ciência esta estendendo como o viros funciona. lo… Ver mais,Positivo
ela só quer ficar famosa,Positivo
Famosa entre quem? rs,Neutro
sim triste,Neutro
"O numero de mortes aumentando todo dia, liga na Italia e diz que ta faltando reza, antes que o numero chegue a 1000 por dia.",Negativo
infelismente á pessoas sem amor a si propria,Positivo
"Vou dormir, não estou impedindo ninguém de nada, quem sou eu? só estou expondo um raciocinio lógico. Nem todo mundo é capacitado para entender, mas minha parte u faço. rs",Negativo
Olha isso Rebeca miranda,Neutro
sim deu pra ver no seu Facebook vc comparando EUA com o Brasil. o Brasil foi devastado pelo pt e agora estamos sem hospitais e com muitos estádios de futebol,Positivo
boa noite que Deus nos abençoe,Positivo
"O presidente gasta 40 mil por dia com cartão corporativo, 10 milhoes por ano com aluguel de carros de luxo e não investe em saúde por quê?",Negativo
Boa noite que Deus abençoe todos nós ...,Positivo
"por que lula deu trilhões para a ditadura cubana agora o nosso pais esta quebrado , dava para enfrentar 3 pandemia, mais não esquenta que nem todos tem a mente aberda para entender",Positivo
"O PT saiu do poder tem quase mais de 2 anos... por que não questiona o presidente se pronunciando falando que essas mortes não são nada? que é só uma coisa inofensiva. Foi isso que eu quis dizer, aprenda a ler e interpretar. … Ver mais",Negativo
"Trilhões? kkkkkkkkkkkk Amigo, sua vergonha é tanta que isso ultrapassa a lista inteira da forbes dos maiores Bilionários do país!",Negativo
sim eu te roubo 13 anos e em 2 anos pergunto por que vc nao tem nada pra me oferecer,Positivo
"Cara, vai estudar porque você é bem burro. Isso é maior que o PIB dos EUA. kkkkkkkkkk… Ver mais",Negativo
"https://folhapolitica.jusbrasil.com.br/noticias/458538463/sob-lula-e-dilma-valor-emprestado-ao-bndes-supera-o-da-reconstrucao-da-europa-pos-2a-guerra/amp  Sob Lula e Dilma, valor emprestado ao BNDES supera o da reconstrução da Europa pós 2ª Guerra FOLHAPOLITICA.JUSBRASIL.COM.BR Sob Lula e Dilma, valor emprestado ao BNDES supera o da reconstrução da Europa pós 2ª Guerra Sob Lula e Dilma, valor emprestado ao BNDES supera o da reconstrução da Europa pós 2ª Guerra",Positivo
isso ai,Neutro
se escreve no BBB,Neutro
"E os trilhões? O governo não é próprio daqui, o próprio Bolsonaro em ajuda com a crise politica da Venezuela destinou mais de 200 milhões.… Ver mais  Governo libera R$ 223,8 milhões para assistência emergencial e acolhimento de venezuelanos G1.GLOBO.COM Governo libera R$ 223,8 milhões para assistência emergencial e acolhimento de venezuelanos Governo libera R$ 223,8 milhões para assistência emergencial e acolhimento de venezuelanos",Negativo
"https://folhapolitica.jusbrasil.com.br/noticias/458538463/sob-lula-e-dilma-valor-emprestado-ao-bndes-supera-o-da-reconstrucao-da-europa-pos-2a-guerra/amp não foi so pra Cuba linda FOLHAPOLITICA.JUSBRASIL.COM.BR Sob Lula e Dilma, valor emprestado ao BNDES supera o da reconstrução da Europa pós 2ª Guerra Sob Lula e Dilma, valor emprestado ao BNDES supera o da reconstrução da Europa pós 2ª Guerra",Positivo